{
  "document_id": "sample-doc",
  "source_pdf": "sample.pdf",
  "meta": {
    "coord_space": "pdf",
    "version": 1,
    "updated_at": "2026-07-27T00:00:00Z"
  },
  "pages": [
    {
      "page_number": 1,
      "width": 595.0,
      "height": 842.0,
      "elements": [
        {
          "id": "p1_e1",
          "label": "title",
          "bbox": [72.0, 80.0, 420.0, 130.0],
          "score": 0.98,
          "locked": false,
          "hidden": false,
          "notes": "Example title box"
        },
        {
          "id": "p1_e2",
          "label": "abstract",
          "bbox": [72.0, 170.0, 520.0, 260.0],
          "score": 0.94,
          "locked": false,
          "hidden": false,
          "notes": "Example abstract box"
        }
      ]
    }
  ]
}
